11:22:00.520082 IP6 :: > ff02::16: HBH ICMP6, multicast listener report v2, 1 group record(s), length 28
11:22:00.536079 IP6 :: > ff02::16: HBH ICMP6, multicast listener report v2, 1 group record(s), length 28
11:22:00.540306 IP 0.0.0.0.bootpc > 255.255.255.255.bootps: BOOTP/DHCP, Request from 68:f7:28:11:2a:41 (oui Unknown), length 300
11:22:00.609984 ARP, Request who-has 169.254.155.63 tell localhost, length 46
11:22:00.619105 ARP, Request who-has localhost tell localhost, length 46
11:22:00.631805 ARP, Request who-has 169.254.18.86 tell localhost, length 46
11:22:00.638866 74:25:8a:04:80:0a (oui Unknown) > 01:80:c2:00:00:0a (oui Unknown), ethertype Unknown (0x88a7), length 171: 
	0x0000:  0003 0000 01b4 dd5c 0001 000e 0000 0000  .......\........
	0x0010:  7425 8a04 7ffb 0007 0014 4833 4320 5335  t%........H3C.S5
	0x0020:  3132 302d 3438 502d 4549 000e 0013 5265  120-48P-EI....Re
	0x0030:  6c65 6173 6520 3232 3032 5030 3600 1100  lease.2202P06...
	0x0040:  1356 3330 3052 3030 3142 3031 4430 3033  .V300R001B01D003
	0x0050:  0010 0007 3130 3800 0c00 1410 0000 0000  ....108.........
	0x0060:  0000 0000 0000 0000 0000 0000 0300 1335  ...............5
	0x0070:  3034 5f49 4e54 4552 4e45 545f 5357 0002  04_INTERNET_SW..
	0x0080:  0019 4769 6761 6269 7445 7468 6572 6e65  ..GigabitEtherne
	0x0090:  7431 2f30 2f31 3000 0b00 0600 03         t1/0/10......
11:22:00.670133 ARP, Request who-has localhost tell localhost, length 46
11:22:00.695175 ARP, Request who-has localhost tell localhost, length 46
11:22:00.696332 ARP, Request who-has localhost tell localhost, length 46
11:22:00.697510 ARP, Request who-has 169.254.65.107 tell localhost, length 46
11:22:00.730306 IP localhost.60235 > 239.255.255.250.1900: UDP, length 133
11:22:00.735155 ARP, Request who-has localhost tell localhost, length 46
11:22:00.758767 STP 802.1s, Rapid STP, CIST Flags [Learn, Forward, Agreement]
11:22:00.762812 IP6 fe80::2d55:9ff4:1d75:5879.dhcpv6-client > ff02::1:2.dhcpv6-server: dhcp6 solicit
11:22:00.856155 IP6 :: > ff02::1:ff11:2a41: ICMP6, neighbor solicitation, who has fe80::6af7:28ff:fe11:2a41, length 24
11:22:00.956994 IP localhost.1534 > localhost.1534: UDP, length 8
11:22:00.973680 ARP, Request who-has localhost tell localhost, length 46
11:22:01.133215 IP6 fe80::642a:1ec:bfee:3442.dhcpv6-client > ff02::1:2.dhcpv6-server: dhcp6 solicit
11:22:01.199238 ARP, Request who-has 169.254.123.175 tell localhost, length 46
11:22:01.200393 ARP, Request who-has 169.254.100.0 tell localhost, length 46
11:22:01.201573 ARP, Request who-has 169.254.155.63 tell localhost, length 46
11:22:01.203039 ARP, Request who-has 169.254.18.86 tell localhost, length 46
11:22:01.267324 LLDP, name 504_INTERNET_SW, length 347
11:22:01.310168 IP 0.0.0.0.bootpc > 255.255.255.255.bootps: BOOTP/DHCP, Request from 9c:f3:87:b2:02:74 (oui Unknown), length 300
11:22:01.416913 ARP, Request who-has localhost tell localhost, length 46
11:22:01.729344 IP localhost.32976 > 239.122.75.227.20404: UDP, length 83
11:22:01.823584 ARP, Request who-has localhost tell localhost, length 46
11:22:01.836918 STP 802.1d, Config, Flags [none], bridge-id 8000.00:1d:92:3c:3c:06.8001, length 43
11:22:01.856149 IP6 fe80::6af7:28ff:fe11:2a41 > ff02::16: HBH ICMP6, multicast listener report v2, 1 group record(s), length 28
11:22:01.856163 IP6 fe80::6af7:28ff:fe11:2a41 > ip6-allrouters: ICMP6, router solicitation, length 16
11:22:01.860671 IP6 fe80::7051:68d9:f538:d12c.dhcpv6-client > ff02::1:2.dhcpv6-server: dhcp6 solicit
11:22:01.864110 IP6 fe80::6af7:28ff:fe11:2a41 > ff02::16: HBH ICMP6, multicast listener report v2, 1 group record(s), length 28
11:22:10.670186 ARP, Request who-has localhost tell localhost, length 46
11:22:15.576442 IP localhost.59881 > google-public-dns-a.google.com.domain: 62643+ PTR? 187.10.168.192.in-addr.arpa. (45)
11:22:15.627809 IP6 fe80::2d55:9ff4:1d75:5879.56559 > ff02::1:3.hostmon: UDP, length 22
11:22:20.591969 IP localhost.31096 > google-public-dns-a.google.com.domain: 4686+ PTR? 157.11.168.192.in-addr.arpa. (45)
11:22:20.602274 IP localhost.netbios-ns > localhost.netbios-ns: NBT UDP PACKET(137): QUERY; REQUEST; BROADCAST
11:22:20.604843 IP localhost.6093 > google-public-dns-a.google.com.domain: 36008+ PTR? 73.11.168.192.in-addr.arpa. (44)
11:22:20.620936 IP localhost.9210 > google-public-dns-a.google.com.domain: 56167+ PTR? 25.10.168.192.in-addr.arpa. (44)
11:22:20.704956 ARP, Request who-has 169.254.90.67 tell localhost, length 46
11:22:25.633629 IP localhost.52306 > google-public-dns-a.google.com.domain: 29595+ PTR? 250.255.255.239.in-addr.arpa. (46)
11:22:30.660830 IP localhost.13985 > google-public-dns-a.google.com.domain: 26092+ PTR? 69.10.168.192.in-addr.arpa. (44)
11:22:30.700279 IP localhost.61543 > google-public-dns-a.google.com.domain: 9905+ PTR? 2.0.0.0.1.0.0.0.0.0.0.0.0.0.0.0.0.0.0.0.0.0.0.0.0.0.0.0.2.0.f.f.ip6.arpa. (90)
11:22:30.722790 IP google-public-dns-a.google.com.domain > localhost.61543: 9905 NXDomain 0/1/0 (160)
11:22:30.744112 IP localhost.35126 > google-public-dns-a.google.com.domain: 5910+ PTR? 1.4.a.2.1.1.f.f.1.0.0.0.0.0.0.0.0.0.0.0.0.0.0.0.0.0.0.0.2.0.f.f.ip6.arpa. (90)
11:22:30.780457 IP localhost.43065 > google-public-dns-a.google.com.domain: 48195+ PTR? 255.11.168.192.in-addr.arpa. (45)
11:22:30.823386 IP localhost.11233 > google-public-dns-a.google.com.domain: 65498+ PTR? 97.11.168.192.in-addr.arpa. (44)
11:22:30.877453 IP localhost.57342 > google-public-dns-a.google.com.domain: 2927+ PTR? 2.4.4.3.e.e.f.b.c.e.1.0.a.2.4.6.0.0.0.0.0.0.0.0.0.0.0.0.0.8.e.f.ip6.arpa. (90)
11:22:30.954817 IP localhost.1534 > localhost.1534: UDP, length 8
11:22:35.970010 IP localhost.netbios-ns > localhost.netbios-ns: NBT UDP PACKET(137): QUERY; REQUEST; BROADCAST
11:22:40.912763 IP localhost.58723 > google-public-dns-a.google.com.domain: 21690+ PTR? 227.75.122.239.in-addr.arpa. (45)
11:22:40.914873 IP google-public-dns-a.google.com.domain > localhost.58723: 21690 NXDomain 0/1/0 (102)
11:22:40.929529 ARP, Reply localhost is-at 2c:8a:72:3d:d9:87 (oui Unknown), length 46
11:22:40.972494 IP localhost > 224.0.0.253: igmp v2 report 224.0.0.253
11:22:40.993103 STP 802.1s, Rapid STP, CIST Flags [Learn, Forward, Agreement]
11:22:40.995310 IP localhost.netbios-ns > localhost.netbios-ns: NBT UDP PACKET(137): QUERY; REQUEST; BROADCAST
11:22:45.926542 IP localhost.26355 > google-public-dns-a.google.com.domain: 49531+ PTR? 174.10.168.192.in-addr.arpa. (45)
11:22:45.933519 IP localhost.33793 > google-public-dns-a.google.com.domain: 61994+ PTR? c.2.1.d.8.3.5.f.9.d.8.6.1.5.0.7.0.0.0.0.0.0.0.0.0.0.0.0.0.8.e.f.ip6.arpa. (90)
11:22:45.946357 IP google-public-dns-a.google.com.domain > localhost.33793: 61994 NXDomain 0/1/0 (125)
11:22:45.946959 IP localhost.31767 > google-public-dns-a.google.com.domain: 13961+ PTR? 8.8.8.8.in-addr.arpa. (38)
11:22:45.955563 IP localhost.1534 > localhost.1534: UDP, length 8
11:22:45.956892 IP google-public-dns-a.google.com.domain > localhost.31767: 13961 1/12/11 PTR google-public-dns-a.google.com. (502)
11:22:45.957436 IP localhost.39843 > google-public-dns-a.google.com.domain: 36935+ PTR? 218.11.168.192.in-addr.arpa. (45)
11:22:45.957816 IP6 fe80::d8b9:f86f:fed1:b2bb.51250 > ff02::c.3702: UDP, length 1093
11:22:45.964569 IP localhost.46006 > google-public-dns-a.google.com.domain: 37863+ PTR? 3.0.0.0.1.0.0.0.0.0.0.0.0.0.0.0.0.0.0.0.0.0.0.0.0.0.0.0.2.0.f.f.ip6.arpa. (90)
11:22:45.970332 IP localhost.43714 > google-public-dns-a.google.com.domain: 491+ PTR? 195.10.168.192.in-addr.arpa. (45)
11:22:45.978222 IP google-public-dns-a.google.com.domain > localhost.43714: 491 1/1/2 PTR localhost. (126)
11:22:45.993264 IP localhost > 224.0.0.251: igmp v2 report 224.0.0.251
11:22:46.044279 IP6 fe80::d8b9:f86f:fed1:b2bb > ff02::16: HBH ICMP6, multicast listener report v2, 1 group record(s), length 28
11:22:46.054764 IP6 fe80::d8b9:f86f:fed1:b2bb.56669 > ff02::1:3.hostmon: UDP, length 24
11:22:50.981496 IP localhost.2753 > google-public-dns-a.google.com.domain: 58743+ PTR? 255.179.168.192.in-addr.arpa. (46)
11:22:50.986869 IP google-public-dns-a.google.com.domain > localhost.2753: 58743 1/1/2 PTR localhost. (127)
11:22:50.987417 IP localhost.7666 > google-public-dns-a.google.com.domain: 40673+ PTR? 124.177.168.192.in-addr.arpa. (46)
11:22:50.991965 IP google-public-dns-a.google.com.domain > localhost.7666: 40673 1/1/2 PTR localhost. (127)
11:22:50.992618 IP localhost.39365 > google-public-dns-a.google.com.domain: 38704+ PTR? 219.11.168.192.in-addr.arpa. (45)
11:22:50.998658 IP google-public-dns-a.google.com.domain > localhost.39365: 38704 1/1/2 PTR localhost. (126)
11:22:50.999053 IP localhost.35459 > google-public-dns-a.google.com.domain: 15509+ PTR? 253.0.0.224.in-addr.arpa. (42)
11:22:51.006083 IP google-public-dns-a.google.com.domain > localhost.35459: 15509 NXDomain 0/1/0 (99)
11:22:51.062750 STP 802.1s, Rapid STP, CIST Flags [Learn, Forward, Agreement]
11:22:51.106670 IP6 fe80::6af7:28ff:fe11:2a41.mdns > ff02::fb.mdns: 0 PTR (QM)? 253.0.0.224.in-addr.arpa. (42)
11:22:51.106753 IP localhost.mdns > 224.0.0.251.mdns: 0 PTR (QM)? 253.0.0.224.in-addr.arpa. (42)
11:22:51.121590 IP localhost.41178 > google-public-dns-a.google.com.domain: 176+ A? lzj.passwd1.com. (33)
11:22:51.126323 IP google-public-dns-a.google.com.domain > localhost.41178: 176 0/1/0 (90)
11:22:51.194499 ARP, Request who-has 169.254.30.84 tell localhost, length 46
11:22:56.010531 IP localhost.27097 > google-public-dns-a.google.com.domain: 10141+ PTR? 205.11.168.192.in-addr.arpa. (45)
11:22:56.013242 IP google-public-dns-a.google.com.domain > localhost.27097: 10141 1/1/2 PTR localhost. (126)
11:22:56.013901 IP localhost.41233 > google-public-dns-a.google.com.domain: 6354+ PTR? c.0.0.0.0.0.0.0.0.0.0.0.0.0.0.0.0.0.0.0.0.0.0.0.0.0.0.0.2.0.f.f.ip6.arpa. (90)
11:22:56.019665 IP google-public-dns-a.google.com.domain > localhost.41233: 6354 NXDomain 0/1/0 (160)
11:22:56.020286 IP localhost.22109 > google-public-dns-a.google.com.domain: 38873+ PTR? b.b.2.b.1.d.e.f.f.6.8.f.9.b.8.d.0.0.0.0.0.0.0.0.0.0.0.0.0.8.e.f.ip6.arpa. (90)
11:22:56.023023 IP google-public-dns-a.google.com.domain > localhost.22109: 38873 NXDomain 0/1/0 (125)
11:22:56.023638 IP localhost.2609 > google-public-dns-a.google.com.domain: 1247+ PTR? 251.0.0.224.in-addr.arpa. (42)
11:22:56.026198 IP google-public-dns-a.google.com.domain > localhost.2609: 1247 NXDomain 0/1/0 (99)
11:22:56.040869 ARP, Request who-has localhost tell 0.0.0.0, length 46
11:22:56.106818 IP localhost.netbios-ns > localhost.netbios-ns: NBT UDP PACKET(137): QUERY; REQUEST; BROADCAST
11:22:56.126949 IP6 fe80::6af7:28ff:fe11:2a41.mdns > ff02::fb.mdns: 0 PTR (QM)? 251.0.0.224.in-addr.arpa. (42)
11:22:56.127030 IP localhost.mdns > 224.0.0.251.mdns: 0 PTR (QM)? 251.0.0.224.in-addr.arpa. (42)
11:22:56.146229 IP localhost.32966 > google-public-dns-a.google.com.domain: 48779+ A? lzj.passwd1.com. (33)
11:22:56.150124 IP google-public-dns-a.google.com.domain > localhost.32966: 48779 0/1/0 (90)
11:23:01.035952 IP localhost.12589 > google-public-dns-a.google.com.domain: 13848+ PTR? b.f.0.0.0.0.0.0.0.0.0.0.0.0.0.0.0.0.0.0.0.0.0.0.0.0.0.0.2.0.f.f.ip6.arpa. (90)
11:23:01.042116 IP google-public-dns-a.google.com.domain > localhost.12589: 13848 NXDomain 0/1/0 (160)
11:23:01.047834 IP6 fe80::f88a:6679:a032:2cd6.dhcpv6-client > ff02::1:2.dhcpv6-server: dhcp6 solicit
11:23:01.065259 ARP, Request who-has localhost tell localhost, length 46
11:23:01.096634 IP localhost.netbios-ns > localhost.netbios-ns: NBT UDP PACKET(137): QUERY; REQUEST; BROADCAST
11:23:01.142837 IP6 fe80::6af7:28ff:fe11:2a41.mdns > ff02::fb.mdns: 0 PTR (QM)? 84.30.254.169.in-addr.arpa. (44)
11:23:01.142902 IP localhost.mdns > 224.0.0.251.mdns: 0 PTR (QM)? 84.30.254.169.in-addr.arpa. (44)
11:23:01.173408 IP localhost.22895 > google-public-dns-a.google.com.domain: 16097+ A? lzj.passwd1.com. (33)
11:23:01.178135 IP google-public-dns-a.google.com.domain > localhost.22895: 16097 0/1/0 (90)
11:23:01.183455 STP 802.1s, Rapid STP, CIST Flags [Learn, Forward, Agreement]
11:23:01.193198 ARP, Request who-has localhost tell localhost, length 46
11:23:01.194341 ARP, Request who-has localhost tell localhost, length 46
11:23:01.225228 ARP, Request who-has localhost tell localhost, length 46
11:23:01.313061 IP localhost.netbios-ns > localhost.netbios-ns: NBT UDP PACKET(137): QUERY; REQUEST; BROADCAST
11:23:01.442331 34:23:ba:ad:7c:82 (oui Unknown) > Broadcast Null Supervisory, Receiver not Ready, rcv seq 64, Flags [Poll], length 46
11:23:01.627401 IP localhost.56822 > google-public-dns-a.google.com.domain: 55143+ A? daisy.ubuntu.com. (34)
11:23:06.044340 IP localhost.13078 > google-public-dns-a.google.com.domain: 12502+ PTR? 186.11.168.192.in-addr.arpa. (45)
11:23:06.046600 IP google-public-dns-a.google.com.domain > localhost.13078: 12502 1/1/2 PTR localhost. (126)
11:23:06.046949 IP localhost.43322 > google-public-dns-a.google.com.domain: 28121+ PTR? 6.d.c.2.2.3.0.a.9.7.6.6.a.8.8.f.0.0.0.0.0.0.0.0.0.0.0.0.0.8.e.f.ip6.arpa. (90)
11:23:06.051849 IP google-public-dns-a.google.com.domain > localhost.43322: 28121 NXDomain 0/1/0 (125)
11:23:06.052469 IP localhost.2748 > google-public-dns-a.google.com.domain: 41909+ PTR? 13.11.168.192.in-addr.arpa. (44)
11:23:06.057781 IP google-public-dns-a.google.com.domain > localhost.2748: 41909 1/1/2 PTR localhost. (125)
11:23:06.058339 IP localhost.2520 > google-public-dns-a.google.com.domain: 6736+ PTR? 1.10.168.192.in-addr.arpa. (43)
11:23:06.059419 IP6 fe80::a4ab:501d:1aa2:ed1f.dhcpv6-client > ff02::1:2.dhcpv6-server: dhcp6 solicit
11:23:06.062008 IP google-public-dns-a.google.com.domain > localhost.2520: 6736 1/1/2 PTR localhost. (124)
11:23:06.062573 IP localhost.56388 > google-public-dns-a.google.com.domain: 25309+ PTR? 163.11.168.192.in-addr.arpa. (45)
11:23:06.064924 IP google-public-dns-a.google.com.domain > localhost.56388: 25309 1/1/2 PTR localhost. (126)
11:23:06.065578 IP localhost.2859 > google-public-dns-a.google.com.domain: 43673+ PTR? 8.10.168.192.in-addr.arpa. (43)
11:23:06.067350 IP google-public-dns-a.google.com.domain > localhost.2859: 43673 1/1/2 PTR localhost. (124)
11:23:06.067925 IP localhost.13604 > google-public-dns-a.google.com.domain: 42376+ PTR? 15.10.168.192.in-addr.arpa. (44)
11:23:06.069806 IP google-public-dns-a.google.com.domain > localhost.13604: 42376 1/1/2 PTR localhost. (125)
11:23:06.070379 IP localhost.34299 > google-public-dns-a.google.com.domain: 21995+ PTR? 217.11.168.192.in-addr.arpa. (45)
11:23:06.071445 IP google-public-dns-a.google.com.domain > localhost.34299: 21995 1/1/2 PTR localhost. (126)
11:23:06.072015 IP localhost.43719 > google-public-dns-a.google.com.domain: 46578+ PTR? 194.11.168.192.in-addr.arpa. (45)
11:23:06.073427 IP google-public-dns-a.google.com.domain > localhost.43719: 46578 1/1/2 PTR localhost. (126)
11:23:06.074138 IP localhost.61179 > google-public-dns-a.google.com.domain: 25937+ PTR? f.1.d.e.2.a.a.1.d.1.0.5.b.a.4.a.0.0.0.0.0.0.0.0.0.0.0.0.0.8.e.f.ip6.arpa. (90)
11:23:06.078245 IP google-public-dns-a.google.com.domain > localhost.61179: 25937 NXDomain 0/1/0 (125)
11:23:06.098535 IP6 fe80::d8b9:f86f:fed1:b2bb.63189 > ff02::1:3.hostmon: UDP, length 22
11:23:06.099013 IP6 fe80::d8b9:f86f:fed1:b2bb.50515 > ff02::1:3.hostmon: UDP, length 22
11:23:06.200341 IP localhost.9292 > google-public-dns-a.google.com.domain: 65316+ A? lzj.passwd1.com. (33)
11:23:06.209915 IP google-public-dns-a.google.com.domain > localhost.9292: 65316 0/1/0 (90)
11:23:06.288435 ARP, Request who-has localhost tell localhost, length 46
11:23:06.288903 IP localhost.6042 > google-public-dns-a.google.com.domain: 33916+ PTR? 254.11.168.192.in-addr.arpa. (45)
11:23:06.296758 IP6 fe80::4832:e7ce:cabf:9927.dhcpv6-client > ff02::1:2.dhcpv6-server: dhcp6 solicit
11:23:06.304221 IP google-public-dns-a.google.com.domain > localhost.6042: 33916 1/1/2 PTR localhost. (126)
11:23:06.304754 IP localhost.16935 > google-public-dns-a.google.com.domain: 9288+ PTR? 7.2.9.9.f.b.a.c.e.c.7.e.2.3.8.4.0.0.0.0.0.0.0.0.0.0.0.0.0.8.e.f.ip6.arpa. (90)
11:23:06.314944 IP google-public-dns-a.google.com.domain > localhost.16935: 9288 NXDomain 0/1/0 (125)
11:23:06.338905 ARP, Request who-has 169.254.178.187 tell 169.254.178.187, length 46
11:23:06.384839 IP6 fe80::d8b9:f86f:fed1:b2bb > ff02::16: HBH ICMP6, multicast listener report v2, 1 group record(s), length 28
11:23:06.385413 IP6 fe80::d8b9:f86f:fed1:b2bb > ff02::16: HBH ICMP6, multicast listener report v2, 1 group record(s), length 28
11:23:06.386018 IP 169.254.178.187 > 224.0.0.252: igmp v2 report 224.0.0.252
11:23:06.388227 IP6 fe80::d8b9:f86f:fed1:b2bb.63586 > ff02::1:3.hostmon: UDP, length 24
11:23:06.388479 IP 169.254.178.187.63586 > 224.0.0.252.hostmon: UDP, length 24
11:23:06.412018 IP6 fe80::d023:4f10:c811:54db.49183 > ff02::1:3.hostmon: UDP, length 22
11:23:06.412296 IP localhost.62365 > 224.0.0.252.hostmon: UDP, length 22
11:23:06.413322 ARP, Request who-has localhost tell localhost, length 46
11:23:06.413660 IP6 fe80::5473:841f:9d06:f656.dhcpv6-client > ff02::1:2.dhcpv6-server: dhcp6 solicit
11:23:06.413670 IP6 fe80::d8b9:f86f:fed1:b2bb > ff02::16: HBH ICMP6, multicast listener report v2, 1 group record(s), length 28
11:23:06.414069 IP6 fe80::d8b9:f86f:fed1:b2bb > ff02::16: HBH ICMP6, multicast listener report v2, 1 group record(s), length 28
11:23:06.414827 IP 169.254.178.187 > 239.255.255.250: igmp v2 report 239.255.255.250
11:23:06.439698 IP6 fe80::6af7:28ff:fe11:2a41.mdns > ff02::fb.mdns: 0 PTR (QM)? 187.178.254.169.in-addr.arpa. (46)
11:23:06.439732 IP localhost.mdns > 224.0.0.251.mdns: 0 PTR (QM)? 187.178.254.169.in-addr.arpa. (46)
11:23:06.498117 IP localhost.netbios-ns > localhost.netbios-ns: NBT UDP PACKET(137): QUERY; REQUEST; BROADCAST
11:23:06.511624 IP6 fe80::d8b9:f86f:fed1:b2bb.63189 > ff02::1:3.hostmon: UDP, length 22
11:23:06.511739 IP6 fe80::d8b9:f86f:fed1:b2bb.50515 > ff02::1:3.hostmon: UDP, length 22
11:23:06.512327 IP6 fe80::d023:4f10:c811:54db.49183 > ff02::1:3.hostmon: UDP, length 22
11:23:06.512338 IP localhost.62365 > 224.0.0.252.hostmon: UDP, length 22
11:23:06.638786 IP localhost.netbios-ns > localhost.netbios-ns: NBT UDP PACKET(137): QUERY; REQUEST; BROADCAST
11:23:06.691065 IP6 fe80::b991:ac63:98f:bcd0.dhcpv6-client > ff02::1:2.dhcpv6-server: dhcp6 solicit
11:23:06.713458 IP localhost.netbios-ns > localhost.netbios-ns: NBT UDP PACKET(137): QUERY; REQUEST; BROADCAST
11:23:06.720470 ARP, Request who-has localhost tell localhost, length 46
11:23:06.809914 IP 0.0.0.0.bootpc > 255.255.255.255.bootps: BOOTP/DHCP, Request from 00:1e:33:dd:5b:15 (oui Unknown), length 300
11:23:06.810118 IP6 fe80::d8b9:f86f:fed1:b2bb.63586 > ff02::1:3.hostmon: UDP, length 24
11:23:06.810136 IP localhost.bootps > 255.255.255.255.bootpc: BOOTP/DHCP, Reply, length 300
11:23:06.810386 IP 169.254.178.187.63586 > 224.0.0.252.hostmon: UDP, length 24
11:23:06.811385 IP 0.0.0.0.bootpc > 255.255.255.255.bootps: BOOTP/DHCP, Request from 00:1e:33:dd:5b:15 (oui Unknown), length 309
11:23:06.812852 IP localhost.bootps > 255.255.255.255.bootpc: BOOTP/DHCP, Reply, length 300
11:23:06.838867 ARP, Request who-has localhost tell 0.0.0.0, length 46
11:23:11.341710 IP localhost.5490 > google-public-dns-a.google.com.domain: 45429+ PTR? 252.0.0.224.in-addr.arpa. (42)
11:23:11.366678 IP google-public-dns-a.google.com.domain > localhost.5490: 45429 NXDomain 0/1/0 (99)
11:23:11.467504 IP6 fe80::6af7:28ff:fe11:2a41.mdns > ff02::fb.mdns: 0 PTR (QM)? 252.0.0.224.in-addr.arpa. (42)
11:23:16.369292 IP localhost.53822 > google-public-dns-a.google.com.domain: 42624+ PTR? b.d.4.5.1.1.8.c.0.1.f.4.3.2.0.d.0.0.0.0.0.0.0.0.0.0.0.0.0.8.e.f.ip6.arpa. (90)
11:23:16.382887 IP google-public-dns-a.google.com.domain > localhost.10339: 20891 0/1/0 (90)
11:23:16.382910 IP google-public-dns-a.google.com.domain > localhost.53822: 42624 NXDomain 0/1/0 (125)
11:23:16.383238 IP localhost.61833 > google-public-dns-a.google.com.domain: 58853+ PTR? 6.5.6.f.6.0.d.9.f.1.4.8.3.7.4.5.0.0.0.0.0.0.0.0.0.0.0.0.0.8.e.f.ip6.arpa. (90)
11:23:16.399014 IP google-public-dns-a.google.com.domain > localhost.61833: 58853 NXDomain 0/1/0 (125)
11:23:16.399684 IP localhost.58920 > google-public-dns-a.google.com.domain: 46338+ PTR? 0.d.c.b.f.8.9.0.3.6.c.a.1.9.9.b.0.0.0.0.0.0.0.0.0.0.0.0.0.8.e.f.ip6.arpa. (90)
11:23:16.412564 IP google-public-dns-a.google.com.domain > localhost.58920: 46338 NXDomain 0/1/0 (125)
11:23:16.413160 IP localhost.55722 > google-public-dns-a.google.com.domain: 1061+ PTR? 139.10.168.192.in-addr.arpa. (45)
11:23:16.424852 IP google-public-dns-a.google.com.domain > localhost.55722: 1061 1/1/2 PTR localhost. (126)
11:23:16.425399 IP localhost.23963 > google-public-dns-a.google.com.domain: 35473+ PTR? 19.10.168.192.in-addr.arpa. (44)
11:23:16.436112 IP google-public-dns-a.google.com.domain > localhost.23963: 35473 1/1/2 PTR localhost. (125)
11:23:16.436779 IP localhost.18513 > google-public-dns-a.google.com.domain: 2720+ PTR? 181.11.168.192.in-addr.arpa. (45)
11:23:16.443598 IP google-public-dns-a.google.com.domain > localhost.18513: 2720 1/1/2 PTR localhost. (126)
11:23:16.454527 IP localhost.netbios-ns > localhost.netbios-ns: NBT UDP PACKET(137): QUERY; REQUEST; BROADCAST
11:23:16.519653 IP localhost.14280 > google-public-dns-a.google.com.domain: 19121+ A? daisy.ubuntu.com. (34)
11:23:16.526966 IP google-public-dns-a.google.com.domain > localhost.14280: 19121 2/13/13 A 91.189.92.57, A 91.189.92.55 (510)
11:23:16.545414 IP localhost.64162 > 239.255.255.251.1900: UDP, length 253
11:23:16.545651 IP localhost.14867 > google-public-dns-a.google.com.domain: 10475+ PTR? 251.255.255.239.in-addr.arpa. (46)
11:23:16.552872 IP google-public-dns-a.google.com.domain > localhost.14867: 10475 NXDomain 0/1/0 (103)
11:23:16.595503 IP localhost.64162 > 239.255.255.251.1900: UDP, length 262
11:23:16.645539 IP localhost.64162 > 239.255.255.251.1900: UDP, length 297
11:23:16.653395 IP6 fe80::6af7:28ff:fe11:2a41.mdns > ff02::fb.mdns: 0 PTR (QM)? 251.255.255.239.in-addr.arpa. (46)
11:23:16.653450 IP localhost.mdns > 224.0.0.251.mdns: 0 PTR (QM)? 251.255.255.239.in-addr.arpa. (46)
11:23:16.695541 IP localhost.64162 > 239.255.255.251.1900: UDP, length 311
11:23:16.721969 ARP, Request who-has localhost tell localhost, length 46
11:23:16.744881 IP6 fe80::d11:8369:80eb:48f2.dhcpv6-client > ff02::1:2.dhcpv6-server: dhcp6 solicit
11:23:16.812646 IP6 fe80::55ef:c4e0:6739:37e.dhcpv6-client > ff02::1:2.dhcpv6-server: dhcp6 solicit
11:23:16.832908 ARP, Request who-has 169.254.178.187 tell 169.254.178.187, length 46
11:23:16.833106 ARP, Request who-has localhost tell localhost, length 46
11:23:16.846897 IP6 fe80::d8b9:f86f:fed1:b2bb > ff02::16: HBH ICMP6, multicast listener report v2, 1 group record(s), length 28
11:23:16.847128 IP 169.254.178.187 > all-routers.mcast.net: igmp leave 224.0.0.252
11:23:16.881157 IP6 fe80::d8b9:f86f:fed1:b2bb > ff02::16: HBH ICMP6, multicast listener report v2, 1 group record(s), length 28
11:23:16.881613 IP 169.254.178.187 > 224.0.0.252: igmp v2 report 224.0.0.252
11:23:16.882781 IP6 fe80::d8b9:f86f:fed1:b2bb.60151 > ff02::1:3.hostmon: UDP, length 24
11:23:16.883035 IP 169.254.178.187.60151 > 224.0.0.252.hostmon: UDP, length 24
11:23:16.913283 ARP, Request who-has localhost tell localhost, length 46
11:23:16.955674 IP6 fe80::d8b9:f86f:fed1:b2bb > ff02::16: HBH ICMP6, multicast listener report v2, 1 group record(s), length 28
11:23:16.956004 IP6 fe80::d8b9:f86f:fed1:b2bb > ff02::16: HBH ICMP6, multicast listener report v2, 1 group record(s), length 28
11:23:16.956856 IP 169.254.178.187 > 239.255.255.250: igmp v2 report 239.255.255.250
11:23:17.081412 ARP, Request who-has localhost tell localhost, length 46
11:23:17.081428 ARP, Request who-has localhost tell localhost, length 46
11:23:17.083284 STP 802.1s, Rapid STP, CIST Flags [Learn, Forward, Agreement]
11:23:17.227965 IP6 fe80::d023:4f10:c811:54db.59764 > ff02::1:3.hostmon: UDP, length 22
11:23:17.228132 IP localhost.56918 > 224.0.0.252.hostmon: UDP, length 22
11:23:17.284008 IP6 fe80::f807:d2c8:90c2:ee13.dhcpv6-client > ff02::1:2.dhcpv6-server: dhcp6 solicit
11:23:17.303866 IP6 fe80::d8b9:f86f:fed1:b2bb.60151 > ff02::1:3.hostmon: UDP, length 24
11:23:17.304110 IP 169.254.178.187.60151 > 224.0.0.252.hostmon: UDP, length 24
11:23:21.582536 IP localhost.40263 > google-public-dns-a.google.com.domain: 17523+ PTR? 236.10.168.192.in-addr.arpa. (45)
11:23:21.607950 IP google-public-dns-a.google.com.domain > localhost.40263: 17523 1/1/2 PTR localhost. (126)
11:23:21.608303 IP localhost.17228 > google-public-dns-a.google.com.domain: 63305+ PTR? 114.10.168.192.in-addr.arpa. (45)
11:23:21.630648 IP google-public-dns-a.google.com.domain > localhost.17228: 63305 1/1/2 PTR localhost. (126)
11:23:21.631235 IP localhost.55891 > google-public-dns-a.google.com.domain: 47798+ PTR? 2.f.8.4.b.e.0.8.9.6.3.8.1.1.d.0.0.0.0.0.0.0.0.0.0.0.0.0.0.8.e.f.ip6.arpa. (90)
11:23:21.653222 IP google-public-dns-a.google.com.domain > localhost.55891: 47798 NXDomain 0/1/0 (125)
11:23:21.653875 IP localhost.1552 > google-public-dns-a.google.com.domain: 63071+ PTR? e.7.3.0.9.3.7.6.0.e.4.c.f.e.5.5.0.0.0.0.0.0.0.0.0.0.0.0.0.8.e.f.ip6.arpa. (90)
11:23:21.674131 IP google-public-dns-a.google.com.domain > localhost.1552: 63071 NXDomain 0/1/0 (125)
11:23:21.674768 IP localhost.6978 > google-public-dns-a.google.com.domain: 10973+ PTR? 79.10.168.192.in-addr.arpa. (44)
11:23:21.691054 ARP, Request who-has localhost tell localhost, length 46
11:23:21.691170 ARP, Request who-has localhost tell localhost, length 46
11:23:21.691964 IP google-public-dns-a.google.com.domain > localhost.6978: 10973 1/1/2 PTR localhost. (125)
11:23:21.692582 IP localhost.11547 > google-public-dns-a.google.com.domain: 64353+ PTR? 2.0.0.224.in-addr.arpa. (40)
11:23:21.711224 IP google-public-dns-a.google.com.domain > localhost.11547: 64353 1/12/12 PTR all-routers.mcast.net. (508)
11:23:21.711709 IP localhost.23550 > google-public-dns-a.google.com.domain: 53057+ PTR? 45.10.168.192.in-addr.arpa. (44)
11:23:21.728231 IP google-public-dns-a.google.com.domain > localhost.23550: 53057 1/1/2 PTR localhost. (125)
11:23:21.728851 IP localhost.13498 > google-public-dns-a.google.com.domain: 42225+ PTR? 247.11.168.192.in-addr.arpa. (45)
11:23:21.729898 IP6 fe80::a003:bf8b:ea75:3d3a.dhcpv6-client > ff02::1:2.dhcpv6-server: dhcp6 solicit
11:23:21.745841 IP google-public-dns-a.google.com.domain > localhost.13498: 42225 1/1/2 PTR localhost. (126)
11:23:21.746465 IP localhost.42917 > google-public-dns-a.google.com.domain: 11068+ PTR? 3.1.e.e.2.c.0.9.8.c.2.d.7.0.8.f.0.0.0.0.0.0.0.0.0.0.0.0.0.8.e.f.ip6.arpa. (90)
11:23:21.763388 IP google-public-dns-a.google.com.domain > localhost.42917: 11068 NXDomain 0/1/0 (125)
11:23:21.764176 IP localhost.23589 > google-public-dns-a.google.com.domain: 51269+ PTR? 39.10.168.192.in-addr.arpa. (44)
11:23:21.782082 IP google-public-dns-a.google.com.domain > localhost.23589: 51269 1/1/2 PTR localhost. (125)
11:23:21.782641 IP localhost.59868 > google-public-dns-a.google.com.domain: 40023+ PTR? 52.10.168.192.in-addr.arpa. (44)
11:23:21.799296 ARP, Request who-has localhost tell localhost, length 46
11:23:21.799458 ARP, Request who-has localhost tell localhost, length 46
11:23:21.799814 IP google-public-dns-a.google.com.domain > localhost.59868: 40023 1/1/2 PTR localhost. (125)
11:23:21.800171 IP localhost.5972 > google-public-dns-a.google.com.domain: 23578+ PTR? a.3.d.3.5.7.a.e.b.8.f.b.3.0.0.a.0.0.0.0.0.0.0.0.0.0.0.0.0.8.e.f.ip6.arpa. (90)
11:23:21.810725 IP localhost.netbios-ns > localhost.netbios-ns: NBT UDP PACKET(137): QUERY; REQUEST; BROADCAST
11:23:21.813943 IP google-public-dns-a.google.com.domain > localhost.5972: 23578 NXDomain 0/1/0 (125)
11:23:21.814513 IP localhost.44197 > google-public-dns-a.google.com.domain: 6152+ PTR? 208.11.168.192.in-addr.arpa. (45)
11:23:21.828802 IP google-public-dns-a.google.com.domain > localhost.44197: 6152 1/1/2 PTR localhost. (126)
11:23:21.833324 STP 802.1d, Config, Flags [none], bridge-id 8000.00:1d:92:3c:3c:06.8001, length 43
11:23:21.848388 IP localhost.netbios-ns > localhost.netbios-ns: NBT UDP PACKET(137): QUERY; REQUEST; BROADCAST
11:23:21.959866 IP localhost.netbios-ns > localhost.netbios-ns: NBT UDP PACKET(137): QUERY; REQUEST; BROADCAST
11:23:21.975424 IP localhost.64196 > 239.255.255.251.1900: UDP, length 253
11:23:22.029137 IP localhost.64196 > 239.255.255.251.1900: UDP, length 262
11:23:22.073643 ARP, Request who-has localhost tell 0.0.0.0, length 46
11:23:22.078773 IP 0.0.0.0.bootpc > 255.255.255.255.bootps: BOOTP/DHCP, Request from e0:b5:2d:6f:4a:d5 (oui Unknown), length 300
11:23:22.078789 IP localhost.64196 > 239.255.255.251.1900: UDP, length 297
11:23:22.085126 ARP, Request who-has localhost tell localhost, length 46
11:23:22.094440 ARP, Request who-has 169.254.142.131 tell localhost, length 46
11:23:22.141404 IP localhost.64196 > 239.255.255.251.1900: UDP, length 311
11:23:22.194909 IP6 fe80::6af7:28ff:fe11:2a41.mdns > ff02::fb.mdns: 0 PTR (QM)? 131.142.254.169.in-addr.arpa. (46)
11:23:22.194952 IP localhost.mdns > 224.0.0.251.mdns: 0 PTR (QM)? 131.142.254.169.in-addr.arpa. (46)
11:23:22.265668 ARP, Request who-has localhost tell localhost, length 46
11:23:22.281071 IP localhost.netbios-ns > localhost.netbios-ns: NBT UDP PACKET(137): QUERY; REQUEST; BROADCAST
11:23:22.284103 IP localhost.netbios-ns > localhost.netbios-ns: NBT UDP PACKET(137): QUERY; REQUEST; BROADCAST
11:23:22.372922 IP6 fe80::2d55:9ff4:1d75:5879.52045 > ff02::1:3.hostmon: UDP, length 22
11:23:22.373387 IP localhost.58577 > 224.0.0.252.hostmon: UDP, length 22
11:23:22.428815 IP localhost.28753 > google-public-dns-a.google.com.domain: 38818+ A? lzj.passwd1.com. (33)
11:23:22.439071 IP google-public-dns-a.google.com.domain > localhost.28753: 38818 0/1/0 (90)
11:23:22.472553 IP6 fe80::2d55:9ff4:1d75:5879.52045 > ff02::1:3.hostmon: UDP, length 22
11:23:22.472726 IP localhost.58577 > 224.0.0.252.hostmon: UDP, length 22
11:23:22.590896 ARP, Request who-has localhost tell localhost, length 46
11:23:22.590913 ARP, Request who-has localhost tell localhost, length 46
11:23:22.603003 IP6 fe80::d023:4f10:c811:54db.50250 > ff02::1:3.hostmon: UDP, length 22
11:23:22.603311 IP localhost.62328 > 224.0.0.252.hostmon: UDP, length 22
11:23:22.675856 IP localhost.netbios-ns > localhost.netbios-ns: NBT UDP PACKET(137): QUERY; REQUEST; BROADCAST
11:23:22.694224 ARP, Request who-has localhost tell localhost, length 46
11:23:22.695472 ARP, Request who-has 169.254.142.131 tell localhost, length 46
11:23:22.702809 IP6 fe80::d023:4f10:c811:54db.50250 > ff02::1:3.hostmon: UDP, length 22
11:23:22.702820 IP localhost.62328 > 224.0.0.252.hostmon: UDP, length 22
11:23:22.903269 IP localhost.netbios-ns > localhost.netbios-ns: NBT UDP PACKET(137): QUERY; REQUEST; BROADCAST
11:23:23.196228 IP6 fe80::6af7:28ff:fe11:2a41.mdns > ff02::fb.mdns: 0 PTR (QM)? 131.142.254.169.in-addr.arpa. (46)
11:23:23.196272 IP localhost.mdns > 224.0.0.251.mdns: 0 PTR (QM)? 131.142.254.169.in-addr.arpa. (46)
11:23:23.253061 STP 802.1s, Rapid STP, CIST Flags [Learn, Forward, Agreement]
11:23:23.316139 IP localhost.netbios-ns > localhost.netbios-ns: NBT UDP PACKET(137): QUERY; REQUEST; BROADCAST
11:23:23.316697 IP6 fe80::91c1:1ee3:5818:b001.63349 > ff02::1:3.hostmon: UDP, length 22
11:23:23.316905 IP localhost.63349 > 224.0.0.252.hostmon: UDP, length 22
11:23:23.439497 IP localhost.64893 > google-public-dns-a.google.com.domain: 37529+ A? lzj.passwd1.com. (33)
11:23:23.439808 IP localhost.netbios-ns > localhost.netbios-ns: NBT UDP PACKET(137): QUERY; REQUEST; BROADCAST
11:23:27.097565 IP localhost.19550 > google-public-dns-a.google.com.domain: 5787+ PTR? 42.10.168.192.in-addr.arpa. (44)
11:23:27.100160 IP google-public-dns-a.google.com.domain > localhost.19550: 5787 1/1/2 PTR localhost. (125)
11:23:27.100475 IP localhost.59475 > google-public-dns-a.google.com.domain: 26371+ PTR? 152.11.168.192.in-addr.arpa. (45)
11:23:27.102786 IP google-public-dns-a.google.com.domain > localhost.59475: 26371 1/1/2 PTR localhost. (126)
11:23:27.103172 IP localhost.3376 > google-public-dns-a.google.com.domain: 63469+ PTR? 1.0.0.b.8.1.8.5.3.e.e.1.1.c.1.9.0.0.0.0.0.0.0.0.0.0.0.0.0.8.e.f.ip6.arpa. (90)
11:23:27.107389 IP google-public-dns-a.google.com.domain > localhost.3376: 63469 NXDomain 0/1/0 (125)
11:23:27.116959 IP6 fe80::4d3d:342c:633:6d8e.dhcpv6-client > ff02::1:2.dhcpv6-server: dhcp6 solicit
11:23:27.117386 IP localhost.4896 > google-public-dns-a.google.com.domain: 19087+ PTR? e.8.d.6.3.3.6.0.c.2.4.3.d.3.d.4.0.0.0.0.0.0.0.0.0.0.0.0.0.8.e.f.ip6.arpa. (90)
11:23:27.123883 IP google-public-dns-a.google.com.domain > localhost.4896: 19087 NXDomain 0/1/0 (125)
11:23:27.204919 IP localhost.netbios-ns > localhost.netbios-ns: NBT UDP PACKET(137): QUERY; REQUEST; BROADCAST
11:23:27.355357 IP localhost.netbios-ns > localhost.netbios-ns: NBT UDP PACKET(137): QUERY; REQUEST; BROADCAST
11:23:27.355631 IP6 fe80::91c1:1ee3:5818:b001.53114 > ff02::1:3.hostmon: UDP, length 22
11:23:27.355669 IP localhost.53114 > 224.0.0.252.hostmon: UDP, length 22
11:23:27.360422 IP localhost.netbios-ns > localhost.netbios-ns: NBT UDP PACKET(137): QUERY; REQUEST; BROADCAST
11:23:27.403824 IP localhost.64229 > 239.255.255.251.1900: UDP, length 253
11:23:27.453190 IP localhost.64229 > 239.255.255.251.1900: UDP, length 262
11:23:27.488383 IP6 fe80::d8b9:f86f:fed1:b2bb.60942 > ff02::1:3.hostmon: UDP, length 22
11:23:27.488794 IP6 fe80::d8b9:f86f:fed1:b2bb.56579 > ff02::1:3.hostmon: UDP, length 22
11:23:27.493829 IP localhost.17187 > google-public-dns-a.google.com.domain: 60244+ A? lzj.passwd1.com. (33)
11:23:27.498546 IP google-public-dns-a.google.com.domain > localhost.17187: 60244 0/1/0 (90)
11:23:27.503281 IP localhost.64229 > 239.255.255.251.1900: UDP, length 297
11:23:27.553182 IP localhost.64229 > 239.255.255.251.1900: UDP, length 311
11:23:27.580788 ARP, Request who-has localhost tell localhost, length 46
11:23:27.580803 ARP, Request who-has localhost tell localhost, length 46
11:23:27.684335 IP localhost.1900 > 239.255.255.250.1900: UDP, length 133
11:23:27.684347 IP localhost.1900 > 239.255.255.250.1900: UDP, length 132
11:23:27.684349 IP localhost.1900 > 239.255.255.250.1900: UDP, length 137
11:23:27.684351 IP localhost.1900 > 239.255.255.250.1900: UDP, length 101
11:23:27.684352 IP localhost.1900 > 239.255.255.250.1900: UDP, length 101
11:23:27.684583 IP localhost.50507 > google-public-dns-a.google.com.domain: 40556+ PTR? 77.10.168.192.in-addr.arpa. (44)
11:23:27.690903 IP google-public-dns-a.google.com.domain > localhost.50507: 40556 1/1/2 PTR localhost. (125)
11:23:27.765709 IP6 fe80::91c1:1ee3:5818:b001.53114 > ff02::1:3.hostmon: UDP, length 22
11:23:27.765776 IP localhost.53114 > 224.0.0.252.hostmon: UDP, length 22
11:23:27.782161 IP localhost.1900 > 239.255.255.250.1900: UDP, length 133
11:23:27.782173 IP localhost.1900 > 239.255.255.250.1900: UDP, length 132
11:23:27.782308 IP localhost.1900 > 239.255.255.250.1900: UDP, length 137
11:23:27.782406 IP localhost.1900 > 239.255.255.250.1900: UDP, length 101
11:23:27.782409 IP localhost.1900 > 239.255.255.250.1900: UDP, length 101
11:23:27.782420 IP localhost.13380 > google-public-dns-a.google.com.domain: 45686+ PTR? 72.10.168.192.in-addr.arpa. (44)
11:23:27.789026 IP google-public-dns-a.google.com.domain > localhost.13380: 45686 1/1/2 PTR localhost. (125)
11:23:27.833325 STP 802.1d, Config, Flags [none], bridge-id 8000.00:1d:92:3c:3c:06.8001, length 43
11:23:27.899861 IP6 fe80::d8b9:f86f:fed1:b2bb.60942 > ff02::1:3.hostmon: UDP, length 22
11:23:27.900079 IP6 fe80::d8b9:f86f:fed1:b2bb.56579 > ff02::1:3.hostmon: UDP, length 22
11:23:27.973958 IP6 fe80::d023:4f10:c811:54db.59567 > ff02::1:3.hostmon: UDP, length 22
11:23:27.974025 IP localhost.55873 > 224.0.0.252.hostmon: UDP, length 22
11:23:28.073979 IP6 fe80::d023:4f10:c811:54db.59567 > ff02::1:3.hostmon: UDP, length 22
11:23:28.073997 IP localhost.55873 > 224.0.0.252.hostmon: UDP, length 22
11:23:28.105947 IP localhost.netbios-ns > localhost.netbios-ns: NBT UDP PACKET(137): QUERY; REQUEST; BROADCAST
11:23:28.131340 IP 0.0.0.0.bootpc > 255.255.255.255.bootps: BOOTP/DHCP, Request from 34:23:ba:ad:7c:82 (oui Unknown), length 308
11:23:28.136768 ARP, Request who-has localhost tell localhost, length 46
11:23:28.144232 ARP, Request who-has 169.254.142.131 tell localhost, length 46
11:23:28.274312 IP localhost.netbios-ns > localhost.netbios-ns: NBT UDP PACKET(137): QUERY; REQUEST; BROADCAST
11:23:28.396859 IP 0.0.0.0.bootpc > 255.255.255.255.bootps: BOOTP/DHCP, Request from 34:23:ba:ad:7c:82 (oui Unknown), length 320
11:23:28.495421 IP localhost.57509 > 239.255.255.250.1900: UDP, length 133
11:23:28.495670 IP localhost.46532 > google-public-dns-a.google.com.domain: 33943+ PTR? 193.11.168.192.in-addr.arpa. (45)
11:23:28.499084 IP localhost.56685 > google-public-dns-a.google.com.domain: 286+ A? lzj.passwd1.com. (33)
11:23:28.505379 IP google-public-dns-a.google.com.domain > localhost.46532: 33943 1/1/2 PTR localhost. (126)
11:23:28.507346 IP google-public-dns-a.google.com.domain > localhost.56685: 286 0/1/0 (90)
11:23:28.580887 ARP, Request who-has localhost tell localhost, length 46
11:23:28.580901 ARP, Request who-has localhost tell localhost, length 46
11:23:28.610401 IP localhost.bootpc > 255.255.255.255.bootps: BOOTP/DHCP, Request from 00:e0:41:00:06:70 (oui Unknown), length 300
11:23:28.610645 IP localhost.35887 > google-public-dns-a.google.com.domain: 7510+ PTR? 51.10.168.192.in-addr.arpa. (44)
11:23:28.615739 IP localhost.55297 > 224.0.0.252.hostmon: UDP, length 22
11:23:28.622183 IP google-public-dns-a.google.com.domain > localhost.35887: 7510 1/1/2 PTR localhost. (125)
11:23:28.694730 ARP, Request who-has localhost tell localhost, length 46
11:23:28.695910 ARP, Request who-has 169.254.142.131 tell localhost, length 46
11:23:28.706270 ARP, Request who-has localhost tell localhost, length 46
11:23:28.706510 IP localhost.36691 > google-public-dns-a.google.com.domain: 30794+ PTR? 213.11.168.192.in-addr.arpa. (45)
11:23:28.719175 IP google-public-dns-a.google.com.domain > localhost.36691: 30794 1/1/2 PTR localhost. (126)
11:23:28.724398 IP localhost.55297 > 224.0.0.252.hostmon: UDP, length 22
11:23:28.856695 IP localhost.netbios-ns > localhost.netbios-ns: NBT UDP PACKET(137): QUERY; REQUEST; BROADCAST
11:23:28.927930 IP localhost.netbios-ns > localhost.netbios-ns: NBT UDP PACKET(137): QUERY; REQUEST; BROADCAST
11:23:29.006550 IP localhost.61925 > 239.255.255.250.1900: UDP, length 133
11:23:29.006811 IP localhost.21274 > gjjline.bta.net.cn.domain: 50902+ PTR? 105.10.168.192.in-addr.arpa. (45)
11:23:29.006817 IP localhost.21274 > google-public-dns-a.google.com.domain: 50902+ PTR? 105.10.168.192.in-addr.arpa. (45)
11:23:29.021754 IP google-public-dns-a.google.com.domain > localhost.21274: 50902 1/1/2 PTR localhost. (126)
11:23:29.021774 IP gjjline.bta.net.cn.domain > localhost.21274: 50902 1/1/2 PTR localhost. (126)
11:23:29.022077 IP localhost.62502 > google-public-dns-a.google.com.domain: 29761+ PTR? 20.0.106.202.in-addr.arpa. (43)
11:23:29.024078 IP localhost.netbios-ns > localhost.netbios-ns: NBT UDP PACKET(137): QUERY; REQUEST; BROADCAST
11:23:29.025848 IP localhost.mdns > 224.0.0.251.mdns: 0*- [0q] 1/0/1 (Cache flush) TXT "model=N53AP" (89)
11:23:29.037238 IP6 fe80::225:90ff:fecf:ca98.dhcpv6-client > ff02::1:2.dhcpv6-server: dhcp6 solicit
11:23:29.039917 IP google-public-dns-a.google.com.domain > localhost.62502: 29761 1/12/12 PTR gjjline.bta.net.cn. (511)
11:23:29.040272 IP localhost.59558 > google-public-dns-a.google.com.domain: 24225+ PTR? 162.11.168.192.in-addr.arpa. (45)
11:23:29.056814 IP google-public-dns-a.google.com.domain > localhost.59558: 24225 1/1/2 PTR localhost. (126)
11:23:29.057150 IP localhost.61750 > google-public-dns-a.google.com.domain: 41205+ PTR? 8.9.a.c.f.c.e.f.f.f.0.9.5.2.2.0.0.0.0.0.0.0.0.0.0.0.0.0.0.8.e.f.ip6.arpa. (90)
11:23:29.078381 IP google-public-dns-a.google.com.domain > localhost.61750: 41205 NXDomain 0/1/0 (125)
11:23:29.082980 STP 802.1s, Rapid STP, CIST Flags [Learn, Forward, Agreement]
